{
  "entries": [
    {
      "authority": "canonical",
      "context_role": "required_when_relevant",
      "created": "2026-05-08",
      "indexed_at": "2026-05-08T13:49:49Z",
      "last_validated": "2026-05-08",
      "module": "runtime-boundary",
      "path": "tests/fixtures/select-context/deprecated-candidate/context/deprecated.md",
      "source_hash": "sha256:fe8a98ef9669d0109d8b3e6304ec4d8cf7d05adc268ad22024e50b7e383eb5f5",
      "status": "deprecated",
      "summary": "Deprecated candidate",
      "tags": [
        "runtime"
      ],
      "type": "policy"
    },
    {
      "authority": "supporting",
      "context_role": "supporting",
      "created": "2026-05-08",
      "indexed_at": "2026-05-08T13:49:49Z",
      "last_validated": "2026-05-08",
      "module": "runtime-boundary",
      "path": "tests/fixtures/select-context/deprecated-candidate/context/active.md",
      "source_hash": "sha256:b88d5f56d9682c7782a30aac9fe68ec35a8d719cf91f55348b9f89a4746ccc0f",
      "status": "active",
      "summary": "Active candidate",
      "tags": [
        "runtime"
      ],
      "type": "policy"
    }
  ],
  "generated_at": "2026-05-08T13:49:49Z",
  "generator": "fixture-generator",
  "generator_version": "0.1.0",
  "repo_commit_hash": "40f70c83a4fad1f2b24e4ec32b98b7dd787860ae",
  "schema_version": "1.0.0",
  "source_index_hash": null,
  "source_index_path": null
}
