{
  "entries": [
    {
      "authority": "canonical",
      "context_role": "required_when_relevant",
      "created": "2026-05-08",
      "indexed_at": "2026-05-08T13:49:49Z",
      "last_validated": "2026-05-08",
      "module": "runtime-boundary",
      "path": "tests/fixtures/select-context/stale-index/context/one.md",
      "source_hash": "sha256:0bcba40feec0781ce84d28b03198907aa05c437a9f3e229b4aa3118de7ae44a8",
      "status": "active",
      "summary": "Stale index candidate",
      "tags": [
        "runtime"
      ],
      "type": "policy"
    }
  ],
  "generated_at": "2026-05-08T13:49:49Z",
  "generator": "fixture-generator",
  "generator_version": "0.1.0",
  "repo_commit_hash": "stale-commit",
  "schema_version": "1.0.0",
  "source_index_hash": null,
  "source_index_path": null
}
