{
  "entries": [
    {
      "authority": "supporting",
      "context_role": "supporting",
      "created": "2026-05-08",
      "indexed_at": "2026-05-08T13:49:49Z",
      "last_validated": "2026-05-08",
      "module": "other-module",
      "path": "tests/fixtures/select-context/no-matching-context/context/unrelated.md",
      "source_hash": "sha256:26055f9f322cc36f9cb33ba629b4b119c362a3238a348879e2087c61f8d6f33e",
      "status": "active",
      "summary": "Unrelated module",
      "tags": [
        "other"
      ],
      "type": "policy"
    }
  ],
  "generated_at": "2026-05-08T13:49:49Z",
  "generator": "fixture-generator",
  "generator_version": "0.1.0",
  "repo_commit_hash": "40f70c83a4fad1f2b24e4ec32b98b7dd787860ae",
  "schema_version": "1.0.0",
  "source_index_hash": null,
  "source_index_path": null
}
