{
  "entries": [
    {
      "authority": "canonical",
      "context_role": "required_when_relevant",
      "created": "2026-05-08",
      "indexed_at": "2026-05-08T13:49:49Z",
      "last_validated": "2026-05-08",
      "module": "runtime-boundary",
      "path": "tests/fixtures/select-context/too-many-candidates/context/c00.md",
      "source_hash": "sha256:9ff183d9e55d16cd846c1dc8ff8ab8843c8940740a32b4ac518f676372de8e26",
      "status": "active",
      "summary": "Match item 0",
      "tags": [
        "runtime"
      ],
      "type": "policy"
    },
    {
      "authority": "canonical",
      "context_role": "required_when_relevant",
      "created": "2026-05-08",
      "indexed_at": "2026-05-08T13:49:49Z",
      "last_validated": "2026-05-08",
      "module": "runtime-boundary",
      "path": "tests/fixtures/select-context/too-many-candidates/context/c01.md",
      "source_hash": "sha256:6c43c1c10ef991f610f182c254cfcc0d941b7b67223d3bd14fdaa361c6487d97",
      "status": "active",
      "summary": "Match item 1",
      "tags": [
        "runtime"
      ],
      "type": "policy"
    },
    {
      "authority": "canonical",
      "context_role": "required_when_relevant",
      "created": "2026-05-08",
      "indexed_at": "2026-05-08T13:49:49Z",
      "last_validated": "2026-05-08",
      "module": "runtime-boundary",
      "path": "tests/fixtures/select-context/too-many-candidates/context/c02.md",
      "source_hash": "sha256:dc574ca0c680e835a328de5a7b023dd1b0c1d01070e725ad1580cc2594afa6e9",
      "status": "active",
      "summary": "Match item 2",
      "tags": [
        "runtime"
      ],
      "type": "policy"
    },
    {
      "authority": "canonical",
      "context_role": "required_when_relevant",
      "created": "2026-05-08",
      "indexed_at": "2026-05-08T13:49:49Z",
      "last_validated": "2026-05-08",
      "module": "runtime-boundary",
      "path": "tests/fixtures/select-context/too-many-candidates/context/c03.md",
      "source_hash": "sha256:7e99ae34af4bb0f3818af67c404e59ef5af2a95e174e99e49a407e6bf41cb82d",
      "status": "active",
      "summary": "Match item 3",
      "tags": [
        "runtime"
      ],
      "type": "policy"
    },
    {
      "authority": "canonical",
      "context_role": "required_when_relevant",
      "created": "2026-05-08",
      "indexed_at": "2026-05-08T13:49:49Z",
      "last_validated": "2026-05-08",
      "module": "runtime-boundary",
      "path": "tests/fixtures/select-context/too-many-candidates/context/c04.md",
      "source_hash": "sha256:c8a718d4fa47c6be9412e9855f49d7d4ac9188ee22ff354243da940f9bcdc44a",
      "status": "active",
      "summary": "Match item 4",
      "tags": [
        "runtime"
      ],
      "type": "policy"
    },
    {
      "authority": "canonical",
      "context_role": "required_when_relevant",
      "created": "2026-05-08",
      "indexed_at": "2026-05-08T13:49:49Z",
      "last_validated": "2026-05-08",
      "module": "runtime-boundary",
      "path": "tests/fixtures/select-context/too-many-candidates/context/c05.md",
      "source_hash": "sha256:794c7e91c69bc952c15ab431a239bbf76af31e4eacf19f2c4e05e2225121e8fb",
      "status": "active",
      "summary": "Match item 5",
      "tags": [
        "runtime"
      ],
      "type": "policy"
    },
    {
      "authority": "canonical",
      "context_role": "required_when_relevant",
      "created": "2026-05-08",
      "indexed_at": "2026-05-08T13:49:49Z",
      "last_validated": "2026-05-08",
      "module": "runtime-boundary",
      "path": "tests/fixtures/select-context/too-many-candidates/context/c06.md",
      "source_hash": "sha256:823a1b35c132ba3895a4b6c544a146d1988aca74f828aa0245364381f2ce74c0",
      "status": "active",
      "summary": "Match item 6",
      "tags": [
        "runtime"
      ],
      "type": "policy"
    },
    {
      "authority": "canonical",
      "context_role": "required_when_relevant",
      "created": "2026-05-08",
      "indexed_at": "2026-05-08T13:49:49Z",
      "last_validated": "2026-05-08",
      "module": "runtime-boundary",
      "path": "tests/fixtures/select-context/too-many-candidates/context/c07.md",
      "source_hash": "sha256:aca8dcbe6981a6d1103e093e0c8b8758c535813387959195687f4c5d2fc557a1",
      "status": "active",
      "summary": "Match item 7",
      "tags": [
        "runtime"
      ],
      "type": "policy"
    },
    {
      "authority": "canonical",
      "context_role": "required_when_relevant",
      "created": "2026-05-08",
      "indexed_at": "2026-05-08T13:49:49Z",
      "last_validated": "2026-05-08",
      "module": "runtime-boundary",
      "path": "tests/fixtures/select-context/too-many-candidates/context/c08.md",
      "source_hash": "sha256:edea94fe43bddefdb7f9d2ff697f0012bd15d948828eee1d87f3273e04634eb1",
      "status": "active",
      "summary": "Match item 8",
      "tags": [
        "runtime"
      ],
      "type": "policy"
    },
    {
      "authority": "canonical",
      "context_role": "required_when_relevant",
      "created": "2026-05-08",
      "indexed_at": "2026-05-08T13:49:49Z",
      "last_validated": "2026-05-08",
      "module": "runtime-boundary",
      "path": "tests/fixtures/select-context/too-many-candidates/context/c09.md",
      "source_hash": "sha256:24947c98fd31adfb4b141ffbaacbd71567356f9318f6278a4e067ecf057f3fd8",
      "status": "active",
      "summary": "Match item 9",
      "tags": [
        "runtime"
      ],
      "type": "policy"
    },
    {
      "authority": "canonical",
      "context_role": "required_when_relevant",
      "created": "2026-05-08",
      "indexed_at": "2026-05-08T13:49:49Z",
      "last_validated": "2026-05-08",
      "module": "runtime-boundary",
      "path": "tests/fixtures/select-context/too-many-candidates/context/c10.md",
      "source_hash": "sha256:caad8674a40691c8decfc3ebea0c11ff2ec3a0e906bb06e6cff5448152d29993",
      "status": "active",
      "summary": "Match item 10",
      "tags": [
        "runtime"
      ],
      "type": "policy"
    },
    {
      "authority": "canonical",
      "context_role": "required_when_relevant",
      "created": "2026-05-08",
      "indexed_at": "2026-05-08T13:49:49Z",
      "last_validated": "2026-05-08",
      "module": "runtime-boundary",
      "path": "tests/fixtures/select-context/too-many-candidates/context/c11.md",
      "source_hash": "sha256:2085315f4b60bb6a25d8dd2e95f357d1b9f5eb4c15cbbf2a073ae1e08c36ea4f",
      "status": "active",
      "summary": "Match item 11",
      "tags": [
        "runtime"
      ],
      "type": "policy"
    },
    {
      "authority": "canonical",
      "context_role": "required_when_relevant",
      "created": "2026-05-08",
      "indexed_at": "2026-05-08T13:49:49Z",
      "last_validated": "2026-05-08",
      "module": "runtime-boundary",
      "path": "tests/fixtures/select-context/too-many-candidates/context/c12.md",
      "source_hash": "sha256:fe51f6fbd91a3e9624abf5776bf0701a06ef17ed6927b1029dbd85f2c3978c99",
      "status": "active",
      "summary": "Match item 12",
      "tags": [
        "runtime"
      ],
      "type": "policy"
    }
  ],
  "generated_at": "2026-05-08T13:49:49Z",
  "generator": "fixture-generator",
  "generator_version": "0.1.0",
  "repo_commit_hash": "40f70c83a4fad1f2b24e4ec32b98b7dd787860ae",
  "schema_version": "1.0.0",
  "source_index_hash": null,
  "source_index_path": null
}
